{
  "id": "t-1",
  "commitment_id": "c-1",
  "project_id": "example-web-platform",
  "description": "Draft the onboarding flow wireframes.",
  "status": "complete",
  "priority": "medium",
  "created": "2026-09-02",
  "due_date": "2026-09-10",
  "completed": "2026-09-09",
  "tags": [],
  "notes": ""
}
